{
  "$schema": "https://json-schema.org/draft/2020-12/schema",
  "$id": "https://raw.githubusercontent.com/csilost2001/harmony/main/schemas/v3/generic-definition.v3.schema.json",
  "title": "Generic Definition (v3 汎用設計定義 親 schema)",
  "description": "Layer 2 Generic Definition Catalog の 17 kind 共通メタモデル (#1263 Phase X2 / RFC #1254 件 3.7 で 8 → 14 kind に拡張、#1303 で 14 → 17 kind に拡張、#1310 で 17 → 18 kind に拡張、#1436 で ui-fragment 廃止 → 17 kind)。<project>/<dataDir>/generic-definitions/<kind>/<Name>.json に対応。仕様: docs/spec/generic-definition-layer.md §4.1。本 schema は kind / name / purpose / responsibilities / targets を必須とする共通親で、kind 別の固有 schema (旧 6: data-contract / domain-type / exception-type / application-rule / ui-behavior / runtime-policy は #1064-#1068 で導入、新 7: component-definition / validation-rule / constants / message / domain-event / log-event / log-config は #1263 Phase X2 で導入、追加 3: dialog / message-area / options は #1303 で導入、#1318 で messageArea → message-area kebab-case 統一、#1310 で global 追加) は allOf で本定義を継承する。catalog 記録のため EntityMeta (`id: EntityId` + `uuid: Uuid` + `createdAt/updatedAt`) は採用せず、`name` field が catalog identifier を兼ねる (ファイル名と一致させる運用、#1354 で旧表記を同期)。",
  "type": "object",
  "$ref": "#/$defs/GenericDefinition",
  "$defs": {
    "GenericDefinition": {
      "type": "object",
      "required": [
        "kind",
        "name",
        "purpose",
        "responsibilities",
        "targets"
      ],
      "properties": {
        "$schema": {
          "type": "string",
          "description": "instance JSON が参照する schema 文書への URL/相対パス。IDE の schema 関連付け用 (内容は loader が無視)。"
        },
        "kind": {
          "$ref": "#/$defs/GenericDefinitionKind"
        },
        "name": {
          "$ref": "#/$defs/GenericDefinitionName"
        },
        "purpose": {
          "type": "string",
          "minLength": 1,
          "maxLength": 200,
          "description": "本定義の責務を 1-2 行で示す。「何を表すか」「どこで使うか」を端的に。"
        },
        "responsibilities": {
          "type": "array",
          "items": {
            "type": "string",
            "minLength": 1
          },
          "minItems": 1,
          "description": "本定義が担う責務の列挙。コード生成時の AI が読み取る semantic 情報源。"
        },
        "targets": {
          "type": "array",
          "items": {
            "$ref": "#/$defs/GenericDefinitionTarget"
          },
          "minItems": 1,
          "uniqueItems": true,
          "description": "適用領域。backend / frontend / shared / runtime。例: data-contract の DTO は backend + frontend の shared、runtime-policy は runtime のみ。"
        },
        "fields": {
          "type": "array",
          "items": {
            "$ref": "#/$defs/GenericField"
          },
          "description": "本定義が保持する field / property 一覧 (data-contract / domain-type / exception-type 等で利用)。"
        },
        "operations": {
          "type": "array",
          "items": {
            "$ref": "#/$defs/GenericOperation"
          },
          "description": "本定義が提供する operation / method (component-definition / ui-behavior 等で利用)。"
        },
        "relations": {
          "type": "array",
          "items": {
            "$ref": "#/$defs/GenericRelation"
          },
          "description": "他 catalog 記録 / entity への関係 (継承 / 実装 / 利用 / 変換元先 / 適用対象)。"
        },
        "constraints": {
          "type": "array",
          "items": {
            "type": "string",
            "minLength": 1
          },
          "description": "不変条件・事前/事後条件の自然言語記述。AI コード生成のヒント。"
        },
        "mappingHints": {
          "type": "object",
          "additionalProperties": true,
          "description": "特定 techStack (backend.spring / backend.nestjs / frontend.next 等) への codegen 時のヒント。完全 optional / advisory (Q6 確定、spec §4.1)。本体は言語非依存で完結すること。free-form object (中身は AI が解釈)。"
        },
        "states": {
          "type": "array",
          "items": { "$ref": "#/$defs/GenericState" },
          "minItems": 1,
          "description": "状態の一覧 (state-machine で使う)。状態の名前は、定義の中で一意。"
        },
        "transitions": {
          "type": "array",
          "items": { "$ref": "#/$defs/GenericTransition" },
          "description": "状態の遷移 (state-machine で使う)。from / to は states の名前。"
        },
        "stateColumn": {
          "type": "object",
          "required": ["tableId", "columnId"],
          "properties": {
            "tableId": { "$ref": "common.v3.schema.json#/$defs/EntityId", "description": "状態を持つテーブル。", "x-ref-kind": "table" },
            "columnId": { "$ref": "common.v3.schema.json#/$defs/LocalId", "description": "状態を入れるカラムの id。", "x-ref-kind": "column" }
          },
          "unevaluatedProperties": false,
          "description": "状態を持つテーブルのカラム (state-machine で使う。任意)。"
        },
        "tableId": { "$ref": "common.v3.schema.json#/$defs/EntityId", "description": "対象のテーブル (seed-data で使う)。", "x-ref-kind": "table" },
        "rows": {
          "type": "array",
          "items": { "type": "object", "minProperties": 1 },
          "minItems": 1,
          "description": "初期データの行 (seed-data で使う)。キーはテーブルのカラムの id か物理名。"
        },
        "processFlowId": { "$ref": "common.v3.schema.json#/$defs/EntityId", "description": "対象の処理フロー (job-definition: 実行する処理 / requirement: 要件を課す処理)。", "x-ref-kind": "processFlow" },
        "measure": { "$ref": "#/$defs/GenericMeasure", "description": "要件の目標値 (requirement で使う)。" },
        "schedule": { "$ref": "#/$defs/GenericSchedule", "description": "実行の時刻 (job-definition で使う)。" },
        "retry": { "$ref": "#/$defs/GenericRetry", "description": "失敗したときの再実行の方針 (job-definition で使う)。" }
      },
      "unevaluatedProperties": false
    },
    "GenericState": {
      "type": "object",
      "required": ["name"],
      "properties": {
        "name": { "type": "string", "pattern": "^[A-Za-z][A-Za-z0-9_]*$", "minLength": 1, "maxLength": 64, "description": "状態の名前 (コードの値と対応させる。例: Ordered / Shipped)。" },
        "label": { "type": "string", "minLength": 1, "maxLength": 64, "description": "状態の呼び名 (例: 注文済み)。" },
        "initial": { "type": "boolean", "description": "最初の状態か (1 つだけ)。" },
        "final": { "type": "boolean", "description": "終わりの状態か (これ以上、遷移しない)。" },
        "description": { "type": "string" }
      },
      "unevaluatedProperties": false
    },

    "GenericTransition": {
      "type": "object",
      "required": ["from", "to", "trigger"],
      "properties": {
        "from": { "type": "string", "minLength": 1, "description": "遷移元の状態の名前。" },
        "to": { "type": "string", "minLength": 1, "description": "遷移先の状態の名前。" },
        "trigger": { "type": "string", "minLength": 1, "maxLength": 100, "description": "契機 (例: 出荷を確定する)。" },
        "guard": { "type": "string", "description": "遷移できる条件 (言葉)。" },
        "processFlowId": { "$ref": "common.v3.schema.json#/$defs/EntityId", "description": "この遷移を起こす処理フロー。", "x-ref-kind": "processFlow" },
        "actionId": { "$ref": "common.v3.schema.json#/$defs/LocalId", "description": "処理フローの中のアクション。", "x-ref-kind": "action" },
        "description": { "type": "string" }
      },
      "unevaluatedProperties": false
    },

    "GenericMeasure": {
      "type": "object",
      "required": ["metric", "operator", "value"],
      "properties": {
        "metric": { "type": "string", "minLength": 1, "maxLength": 64, "description": "測るもの (例: 応答時間 / 可用性 / 同時接続数)。" },
        "operator": { "type": "string", "enum": ["<=", "<", ">=", ">", "=="], "description": "目標値との比べ方。" },
        "value": { "type": "number", "description": "目標値。" },
        "unit": { "type": "string", "maxLength": 16, "description": "単位 (例: ms / % / 件)。" },
        "percentile": { "type": "string", "maxLength": 8, "description": "パーセンタイル (例: p95)。" }
      },
      "unevaluatedProperties": false
    },

    "GenericSchedule": {
      "type": "object",
      "required": ["kind"],
      "properties": {
        "kind": { "type": "string", "enum": ["cron", "interval", "event", "manual"], "description": "cron = 時刻の式 / interval = 一定の間隔 / event = 出来事を契機に / manual = 手で起動。" },
        "expression": { "type": "string", "description": "cron の式 (5 つの欄: 分 時 日 月 曜日)、または interval の間隔 (例: PT15M)、event の名前。" },
        "timezone": { "type": "string", "description": "タイムゾーン (例: Asia/Tokyo)。" }
      },
      "unevaluatedProperties": false
    },

    "GenericRetry": {
      "type": "object",
      "required": ["maxAttempts"],
      "properties": {
        "maxAttempts": { "type": "integer", "minimum": 1, "maximum": 100, "description": "最大の試行の回数 (最初の 1 回を含む)。" },
        "backoff": { "type": "string", "enum": ["none", "fixed", "exponential"], "description": "間隔の取り方。" },
        "intervalSeconds": { "type": "integer", "minimum": 0, "description": "最初の間隔 (秒)。" }
      },
      "unevaluatedProperties": false
    },

    "GenericDefinitionKind": {
      "type": "string",
      "enum": [
        "data-contract",
        "domain-type",
        "exception-type",
        "application-rule",
        "validation-rule",
        "ui-behavior",
        "runtime-policy",
        "component-definition",
        "constants",
        "message",
        "domain-event",
        "log-event",
        "log-config",
        "dialog",
        "message-area",
        "options",
        "global",
        "state-machine",
        "seed-data",
        "requirement",
        "job-definition"
      ],
      "description": "Generic Definition Catalog の 21 kind (#1254 件 3.7 / #1263 Phase X2 で 14 種 / #1303 で 14→17 種に拡張、#1310 で global 追加、#1436 で ui-fragment 廃止後 17 種、spec §4.2)。data-contract = DTO/Form/Result/ViewModel 等の層間契約。domain-type = Entity/Model などドメイン型。exception-type = 例外種別・階層・semantic kind。application-rule = 認証認可/ログ/監査などの横断ルール。validation-rule = 業務検証ルール (条件 + メッセージ + severity)。ui-behavior = 画面横断振る舞い。runtime-policy = retry/timeout/circuit breaker/cache 等の横断適用ポリシー。component-definition = service/mapper/validator/formatter 等の責務。constants = ドメイン定数集 (@const.<key> 参照元)。message = メッセージカタログ (@msg.<key> 参照元、i18n source)。domain-event = ドメインイベント定義 (@event.<topic> 参照元)。log-event = ログイベント定義 (@logEvent.<key> 参照元、構造化ログ)。log-config = ログ設定 (@logConfig.<key> 参照元、log level / sink / format)。dialog = ScreenItemEvent effects[].showDialog.target 参照先の dialog カタログ (@dialog.<name> 参照元)。message-area = ScreenItemEvent effects[].setMessage.target 参照先の画面横断 message area カタログ (prefix `@messageArea.<name>` で参照、log-event/log-config と同様に kind=kebab-case / prefix=camelCase の分離、#1318)。options = ScreenItemEvent effects[].setOptions の選択肢カタログ (@options.<name> 参照元)。global = workspace/project 横断の mutable 設定 slot (@var.global.<key> 参照元、Spring @Value / @SessionScope 相当、#1310)。"
    },
    "GenericDefinitionName": {
      "type": "string",
      "pattern": "^[A-Za-z][A-Za-z0-9_]*$",
      "minLength": 1,
      "maxLength": 64,
      "description": "catalog 記録の identifier。ファイル名 (拡張子除く) と一致させる運用。慣例的に PascalCase (OrderForm / UserNotFoundException 等) を推奨するが、camelCase / snake-ish も許容。Identifier (lowerCamelCase 強制) は採用しない (例外クラス名等で PascalCase が業界標準のため)。"
    },
    "GenericDefinitionTarget": {
      "type": "string",
      "enum": [
        "backend",
        "frontend",
        "shared",
        "runtime"
      ],
      "description": "適用領域。backend / frontend / shared (両方) / runtime (実行時横断ポリシー)。"
    },
    "GenericField": {
      "type": "object",
      "required": [
        "name",
        "type"
      ],
      "properties": {
        "name": {
          "type": "string",
          "minLength": 1,
          "maxLength": 64,
          "description": "field 識別子。catalog 内での命名 (camelCase 推奨だが strict 強制はしない、業務概念名の都合があるため)。"
        },
        "type": {
          "type": "string",
          "minLength": 1,
          "description": "field の型。Harmony FieldType (string / integer / decimal / boolean / date / dateTime / 等) または catalog 内他 record への参照 (例: 'OrderItem[]')。kind 別 schema (data-contract / domain-type は #1064、残は #1066-#1068) で更に厳格化される想定。"
        },
        "constraints": {
          "type": "array",
          "items": {
            "type": "string",
            "minLength": 1
          },
          "description": "field 単位の制約 (必須 / 桁数 / 値域等の自然言語記述)。"
        },
        "description": {
          "type": "string",
          "description": "field の意味・用途の説明。"
        }
      },
      "unevaluatedProperties": false
    },
    "GenericOperation": {
      "type": "object",
      "required": [
        "name"
      ],
      "properties": {
        "name": {
          "type": "string",
          "minLength": 1,
          "maxLength": 64,
          "description": "operation 名 (method 名相当)。"
        },
        "inputs": {
          "type": "array",
          "items": {
            "$ref": "#/$defs/GenericField"
          },
          "description": "入力パラメータ列。"
        },
        "outputs": {
          "type": "array",
          "items": {
            "$ref": "#/$defs/GenericField"
          },
          "description": "出力 (戻り値) 列。複数戻り値 / tuple を表現可能。"
        },
        "description": {
          "type": "string",
          "description": "operation の意味・用途の説明。"
        }
      },
      "unevaluatedProperties": false
    },
    "GenericRelation": {
      "type": "object",
      "required": [
        "kind",
        "ref"
      ],
      "properties": {
        "kind": {
          "type": "string",
          "enum": [
            "extends",
            "implements",
            "uses",
            "transformsFrom",
            "transformsTo",
            "appliesTo"
          ],
          "description": "関係種別 (spec §4.1)。extends = 継承、implements = 契約実装、uses = 利用、transformsFrom/To = 変換源/先、appliesTo = 適用対象 (横断ポリシー → 適用先 component 等)。"
        },
        "ref": {
          "type": "string",
          "minLength": 1,
          "description": "参照先。catalog 記録への参照は 'generic-definitions/<kind>/<Name>' 形式、Harmony entity への参照はその entity 慣行に従う (screen-id / process-flow-id 等)。詳細 $ref schema は kind 別 schema で厳格化。"
        },
        "description": {
          "type": "string",
          "description": "関係の補足説明。"
        }
      },
      "unevaluatedProperties": false
    }
  }
}
