{
  "$schema": "../../../../../schemas/v3/generic-definitions/validation-rule.v3.schema.json",
  "kind": "validation-rule",
  "name": "AmountPositiveRange",
  "purpose": "取引金額が許容範囲内 (1 円以上、TransactionLimits.maxAmount 円以下) であることを検証する業務検証ルール (@validation.AmountPositiveRange)。",
  "responsibilities": [
    "createTransaction / updateTransaction の ValidationStep から呼出",
    "TableColumn ck-tx-amount-positive (DB CHECK 制約) と論理的に整合",
    "失敗時は @msg.AmountOutOfRange (min / max placeholder 付き) で表示",
    "上限値は @const.TransactionLimits.maxAmount を参照 (マジックナンバー排除)"
  ],
  "targets": ["shared"],
  "fields": [
    { "name": "amount", "type": "number", "description": "検証対象の金額" }
  ],
  "constraints": [
    "amount >= 1",
    "amount <= @const.TransactionLimits.maxAmount"
  ],
  "relations": [
    { "kind": "uses", "ref": "generic-definitions/constants/TransactionLimits", "description": "上限値を constants から取得" },
    { "kind": "uses", "ref": "generic-definitions/message/AmountOutOfRange", "description": "失敗メッセージ" }
  ]
}
